{
  "schema": "ckb-degree-cell-test-vectors/v1",
  "protocol": "ckb-degree-credential-cell/v1",
  "generatedBy": "scripts/generate-test-vectors.js",
  "recordLength": 75,
  "credentialId": "CKB-DEGREE-COMMUNITY-VECTOR-001",
  "credentialHash": "0x0f4324ffe3627a7a675ca9c72d83a37f97d70e4ec381eee6c6882fbc5e026fd8",
  "issuerLockHash": "0x1111111111111111111111111111111111111111111111111111111111111111",
  "vectors": [
    {
      "name": "active-canonical",
      "valid": true,
      "cellData": "0x01000f4324ffe3627a7a675ca9c72d83a37f97d70e4ec381eee6c6882fbc5e026fd81111111111111111111111111111111111111111111111111111111111111111000000000000000000",
      "expected": {
        "version": 1,
        "status": 0,
        "statusName": "ACTIVE",
        "credentialHash": "0x0f4324ffe3627a7a675ca9c72d83a37f97d70e4ec381eee6c6882fbc5e026fd8",
        "issuerLockHash": "0x1111111111111111111111111111111111111111111111111111111111111111",
        "reasonCode": 0,
        "reasonName": "NONE",
        "revokedAt": "0",
        "revokedAtIso": null,
        "canonical": true,
        "errors": []
      }
    },
    {
      "name": "revoked-canonical",
      "valid": true,
      "cellData": "0x01010f4324ffe3627a7a675ca9c72d83a37f97d70e4ec381eee6c6882fbc5e026fd81111111111111111111111111111111111111111111111111111111111111111028048746800000000",
      "expected": {
        "version": 1,
        "status": 1,
        "statusName": "REVOKED",
        "credentialHash": "0x0f4324ffe3627a7a675ca9c72d83a37f97d70e4ec381eee6c6882fbc5e026fd8",
        "issuerLockHash": "0x1111111111111111111111111111111111111111111111111111111111111111",
        "reasonCode": 2,
        "reasonName": "CREDENTIAL_REPLACED",
        "revokedAt": "1752451200",
        "revokedAtIso": "2025-07-14T00:00:00.000Z",
        "canonical": true,
        "errors": []
      }
    },
    {
      "name": "invalid-status",
      "valid": false,
      "cellData": "0x01090f4324ffe3627a7a675ca9c72d83a37f97d70e4ec381eee6c6882fbc5e026fd81111111111111111111111111111111111111111111111111111111111111111000000000000000000",
      "expected": {
        "version": 1,
        "status": 9,
        "statusName": "UNKNOWN",
        "credentialHash": "0x0f4324ffe3627a7a675ca9c72d83a37f97d70e4ec381eee6c6882fbc5e026fd8",
        "issuerLockHash": "0x1111111111111111111111111111111111111111111111111111111111111111",
        "reasonCode": 0,
        "reasonName": "NONE",
        "revokedAt": "0",
        "revokedAtIso": null,
        "canonical": false,
        "errors": [
          "INVALID_STATUS"
        ]
      }
    },
    {
      "name": "invalid-active-fields",
      "valid": false,
      "cellData": "0x01000f4324ffe3627a7a675ca9c72d83a37f97d70e4ec381eee6c6882fbc5e026fd81111111111111111111111111111111111111111111111111111111111111111010100000000000000",
      "expected": {
        "version": 1,
        "status": 0,
        "statusName": "ACTIVE",
        "credentialHash": "0x0f4324ffe3627a7a675ca9c72d83a37f97d70e4ec381eee6c6882fbc5e026fd8",
        "issuerLockHash": "0x1111111111111111111111111111111111111111111111111111111111111111",
        "reasonCode": 1,
        "reasonName": "ADMINISTRATIVE_CORRECTION",
        "revokedAt": "1",
        "revokedAtIso": "1970-01-01T00:00:01.000Z",
        "canonical": false,
        "errors": [
          "ACTIVE_FIELDS_INVALID"
        ]
      }
    },
    {
      "name": "invalid-revoked-fields",
      "valid": false,
      "cellData": "0x01010f4324ffe3627a7a675ca9c72d83a37f97d70e4ec381eee6c6882fbc5e026fd81111111111111111111111111111111111111111111111111111111111111111000000000000000000",
      "expected": {
        "version": 1,
        "status": 1,
        "statusName": "REVOKED",
        "credentialHash": "0x0f4324ffe3627a7a675ca9c72d83a37f97d70e4ec381eee6c6882fbc5e026fd8",
        "issuerLockHash": "0x1111111111111111111111111111111111111111111111111111111111111111",
        "reasonCode": 0,
        "reasonName": "NONE",
        "revokedAt": "0",
        "revokedAtIso": null,
        "canonical": false,
        "errors": [
          "REVOKED_FIELDS_INVALID"
        ]
      }
    },
    {
      "name": "invalid-length",
      "valid": false,
      "cellData": "0x01000f4324ffe3627a7a675ca9c72d83a37f97d70e4ec381eee6c6882fbc5e026fd811111111111111111111111111111111111111111111111111111111111111110000000000000000",
      "expected": {
        "canonical": false,
        "error": "REVOCATION_DATA_LENGTH_INVALID"
      }
    }
  ]
}
